    <!ELEMENT empleados (empleados+)>
    <!ELEMENT empleado (nombre, id, cargo, salario)>
    <!ELEMENT nombre (#PCDATA)>
    <!ELEMENT id (#PCDATA)>
    <!ELEMENT cargo (#PCDATA)>
    <!ELEMENT salario (#PCDATA)>
