<?xml version="1.0" encoding="UTF-8"?>
<!DOCTYPE empleado SYSTEM "externo1.dtd">
<empleados>
    <empleado>
        <nombre>Terry</nombre>
        <id>1</id>
        <cargo>Ingeniero de Software</cargo>
        <salario>2700</salario>
    </empleado>
    <empleado>
        <nombre>Diego Alonso</nombre>
        <id>2</id>
        <cargo>Product Owner</cargo>
        <salario>2750</salario>
    </empleado>
    <empleado>
        <nombre>Amaia Ruiz</nombre>
        <id>3</id>
        <cargo>Dise√±adora UX</cargo>
        <salario>2200</salario>
    </empleado>        
</empleados>